{
  "schemaVersion": "chimpmaera.extension-trust/external-plugin-preflight-request/v1",
  "subject": {"subjectId":"extension:mcp-risk","subjectVersion":"1.0.0","format":"MCP_SERVER"},
  "source": {"kind":"PINNED_CONTENT","locator":"content+sha256:0000000000000000000000000000000000000000000000000000000000000000","mutable":false,"digest":"0000000000000000000000000000000000000000000000000000000000000000"},
  "licence": {"spdx":"Apache-2.0","evidenceRef":"artifact:sha256:0000000000000000000000000000000000000000000000000000000000000000"},
  "compatibility": {"kind":"NONE","version":null,"tag":null,"commit":null,"artifactDigest":null,"distTag":null},
  "files": [
    {"path":"mcp.json","kind":"FILE","mediaType":"application/json","content":"{\"servers\":{\"fixture\":{\"command\":\"node\",\"args\":[\"server.js\"],\"env\":{\"API_KEY\":\"must-not-cross\"},\"url\":\"https://example.invalid\"}}}","digest":"0000000000000000000000000000000000000000000000000000000000000000"}
  ]
}
